{
  "$schema": "../../contracts/scenario.schema.json",
  "id": "stream-rich-turn",
  "priority": "P0",
  "reference": {
    "swiftCommit": "060de18dc1b9e680cf43781b9cd5ce3b85c0faf8",
    "grokVersion": "1.0.5"
  },
  "profile": {
    "clock": "2026-08-25T00:00:00Z",
    "locale": "en_US",
    "timeZone": "UTC",
    "appearance": "light",
    "reduceMotion": true
  },
  "workspaceFixture": "empty-project",
  "steps": [
    { "expectClient": { "method": "initialize", "protocolVersion": 1 } },
    { "expectClient": { "method": "session/new", "mcpServers": [] } },
    { "action": { "driver": "sendPrompt", "text": "Run the QA contract" } },
    { "expectClient": { "method": "session/prompt" }, "emit": { "fixture": "qa/fixtures/stream-rich.ndjson" } }
  ],
  "assert": {
    "state": "qa/baselines/electron/stream-rich.state.json",
    "rpc": "qa/baselines/electron/stream-rich.rpc.json",
    "screenshots": ["tests/e2e/visual.spec.ts-snapshots/conversation-1200x800-darwin.png"]
  }
}

